Description,GeoName,Unit,,,,,,,,,,,,,,,,,,,,,,,,,,0
All industry total,South Carolina,Millions of current dollars,97425,103456.3,110241.7,115320.6,119478.1,124863.9,131566.5,136982,145403.6,153647.7,162746.3,163886.2,161813.5,165860,172075.1,177618.1,185009.1,194352.7,205816.7,215120.2,223266.7,233251.4,245987.2,245359.5,269802.5,
Private industries,South Carolina,Millions of current dollars,82928.1,88071.7,93662.3,97505.3,101241.3,105637,111210.1,115486,122507.6,129459.3,137270.6,136631.5,134030.8,138105.7,143655.3,148329.9,154814.1,163325.9,173646.6,181780.3,189118.9,198022.7,209327.8,206977.3,229939.7,
"Agriculture, forestry, fishing and hunting",South Carolina,Millions of current dollars,1019.2,855.5,854,1001.4,1118.6,761.3,1108.4,1354.8,1156.8,1143.6,1006.6,1095.8,1121.8,1174.4,1103.3,1166,1437.9,1089.6,1073.3,1050.6,1172.3,1121.4,1017.6,953.7,1378.1,
Farms,South Carolina,Millions of current dollars,744.5,578,571.3,704.8,811.5,463.8,802,1035.7,847.3,753.4,614.8,731.3,759.6,818.2,733.8,794.8,1063.4,675.3,636.3,606.6,718.9,634.5,529.1,448.1,879.1,
"Forestry, fishing, and related activities",South Carolina,Millions of current dollars,274.7,277.4,282.7,296.6,307.1,297.5,306.4,319.1,309.4,390.2,391.8,364.5,362.3,356.2,369.5,371.2,374.5,414.4,437,443.9,453.4,486.8,488.5,505.6,499.0,
"Mining, quarrying, and oil and gas extraction",South Carolina,Millions of current dollars,131.8,159.1,191.1,201.8,173.7,194.4,218.5,275.4,275.9,344.3,266,277.4,265.5,228,236.1,200.6,216,248.3,380.4,393.7,479.8,592.1,613.6,549.2,651.6,
Oil and gas extraction,South Carolina,Millions of current dollars,0.9,0.9,1.3,1,(L),0.1,0.2,0.7,0.5,0.9,0.7,0.5,0.3,0.1,(L),0.5,1.3,0.7,1.5,2,1.3,0.4,0.2,0.6,1.5,
Mining (except oil and gas),South Carolina,Millions of current dollars,129,155.4,185.8,192.3,171.2,192.1,216.1,272.6,273.3,339.2,261.2,273,261.7,222.4,227.5,190.9,206.4,234.2,348.3,377.4,451.7,561.9,576.1,508.8,621.5,
Support activities for mining,South Carolina,Millions of current dollars,1.9,2.8,4,8.5,2.4,2.3,2.1,2,2.2,4.2,4.1,3.9,3.6,5.6,8.6,9.2,8.4,13.4,30.5,14.4,26.7,29.8,37.3,39.7,28.5,
Utilities,South Carolina,Millions of current dollars,2931.9,2829,3062.8,3077.2,3032.1,2946.7,3090.4,3422.8,3487.1,4006,3839,3911.8,4496,5009.4,5163.8,5097.5,5277.4,5584.9,5599.6,5809.5,5789.8,5443.0,5651.6,5441.8,5908.7,
Construction,South Carolina,Millions of current dollars,5309.7,5927.9,6321,6694,6783.1,6823.4,7371,8561.2,9097.7,9806.5,10236.6,9223.6,7602,6504.2,6317.9,6972.3,7536,8230.3,8930.5,9998.9,11256.4,11709.4,12583.9,12490.7,13142.7,
Manufacturing,South Carolina,Millions of current dollars,22038,23192.8,24045.6,24190.1,24889.2,26112.8,27037.9,24203.9,24548.1,25420.7,26490.2,25645.2,25003.7,26451.2,28237.1,29030,29602.9,31036.3,34328.2,35324.8,34369.4,35299.6,38160.4,35346.3,39264.7,
Durable goods manufacturing,South Carolina,Millions of current dollars,9679.7,10396.1,11245.1,11335.5,12474.3,14490.4,15661.8,13657.8,14759.3,14994.2,15205.6,15047.4,13613.7,14488.8,16030.4,17330,17597.8,18229.1,19713.4,21476,20095.4,20363.6,22286.3,20862.9,23662.5,
Wood product manufacturing,South Carolina,Millions of current dollars,498.8,465.3,509.1,466.7,444.5,481.5,472.9,612.1,689.7,679.3,661.6,534.5,417,512.8,548,677.2,820.4,786.5,762.4,919.2,1064.9,1035.0,819.3,1109.4,1556.1,
Nonmetallic mineral product manufacturing,South Carolina,Millions of current dollars,750,820.9,915.6,777.7,841.4,807.4,828.6,907.4,985.1,1079.8,1083.7,819.4,653.8,694.9,752.6,859.3,862.9,759.8,907.3,1023.8,1175.9,1173.0,1144.7,1232.7,1297.8,
Primary metal manufacturing,South Carolina,Millions of current dollars,575.7,599.6,517.2,747.3,592.1,680.5,708.7,1034.4,1459.1,1630,1524.8,1480.3,687.2,831.1,1012.2,1370.2,927.5,1013.5,1094.4,1016.4,1001.9,1124.4,1073.8,998.9,1395.3,
Fabricated metal product manufacturing,South Carolina,Millions of current dollars,2020.7,2037.8,2142,2133.1,1918.9,1920.1,2215.1,2392.6,2417.7,2145,2348.3,2568.3,2242.7,2297.7,2266.8,2582.9,2756,3100.8,3445.6,3460.1,3014.8,2873.3,3048.8,2585.3,2736.8,
Machinery manufacturing,South Carolina,Millions of current dollars,1970.5,2408.9,2684.8,2554.7,3755.7,5280.2,6100.5,2529.9,2538.5,1964.8,2726.2,2510.6,2956.8,2412.3,2835.1,2988.7,2854.2,2453,2543.4,3234,2834.8,2830.1,3432.1,3416.2,3853.5,
Computer and electronic product manufacturing,South Carolina,Millions of current dollars,376.6,323.4,441.5,601,491.7,670.5,447.2,761.5,784,743.8,616.8,678.8,555.3,683.9,737.7,1213.7,1172.6,1640.1,1823.1,1778.3,1656.2,1426.2,1431.4,1351.3,1332.5,
"Electrical equipment, appliance, and component manufacturing",South Carolina,Millions of current dollars,963,893.4,1147.8,1149.7,1160.7,839.9,920.4,986.3,1145,1631.8,1565.8,2044.2,2131.5,2098.5,2065.3,2154.2,2381.9,2351.2,2710.3,2718.7,2150.6,2369.7,2397.4,2131.9,2484.4,
"Motor vehicles, bodies and trailers, and parts manufacturing",South Carolina,Millions of current dollars,1466.9,1776.2,1796.9,1886.4,2087.3,2443.6,2626.9,3049.8,3107.5,3306.5,2597.9,2302.2,1166.8,2390.6,3137.6,3218.5,3497.7,3858.4,4056.7,4383.6,4175.5,4497.2,5595,5053.9,5616.4,
Other transportation equipment manufacturing,South Carolina,Millions of current dollars,295.6,312.2,358.5,390.3,381.7,427.4,415.2,532.5,595.7,663.2,816.5,877.8,1283.6,1349.5,1665.3,1202.6,1255,1226.4,1214.2,1695,1649.2,1738.3,1874.8,1413.4,1619.6,
Furniture and related product manufacturing,South Carolina,Millions of current dollars,232.7,254.6,236.8,244.6,196.3,189.7,152.6,149.4,253.9,330.5,327.9,197.8,219.5,196.5,214.5,244,295.8,336.5,418.3,444.9,449.6,415.4,488.4,596.8,651.4,
Miscellaneous manufacturing,South Carolina,Millions of current dollars,529.3,503.8,494.9,383.9,604,749.6,773.6,701.9,783.1,819.6,936,1033.5,1299.4,1020.9,795.3,818.8,773.9,703,737.7,802,922,881.0,980.7,973.1,1118.6,
Nondurable goods manufacturing,South Carolina,Millions of current dollars,12358.3,12796.8,12800.5,12854.7,12414.9,11622.4,11376.1,10546.2,9788.9,10426.5,11284.6,10597.8,11390,11962.4,12206.7,11700,12005.1,12807.2,14614.8,13848.8,14274,14936.0,15874.1,14483.4,15602.2,
Food and beverage and tobacco product manufacturing,South Carolina,Millions of current dollars,745.7,879.2,955.3,937.9,1139.3,1247,1322.6,951.1,929,1014.5,1080.9,1305,1531.6,1611.8,1546.9,1751.8,1589.3,1806.7,2116.1,2212.4,2096.8,1915.0,2306.2,2098.8,2262.8,
Textile mills and textile product mills,South Carolina,Millions of current dollars,3440.9,3569.3,3479.1,3439,3256.6,2859.6,2140.9,2124.3,1652,1511.6,1404.8,1222.6,927.2,1352.7,1437.4,1328.5,1361,1399.1,1417.3,1491.5,1376.6,1300.8,1470.8,1268.1,1358.1,
"Apparel, leather, and allied product manufacturing",South Carolina,Millions of current dollars,578.5,453.8,227.4,297.3,194.8,157.3,165.4,199.5,158.4,108.1,90,130.5,72.8,63.4,74.5,90.1,126.7,154.1,182.1,113.6,114.1,107.4,137.8,179.5,165.8,
Paper manufacturing,South Carolina,Millions of current dollars,2495.2,2295.1,2414.1,2661.5,2216,2069.2,2107.3,2198.3,2488.9,2783.9,2663.5,2673.5,2901.3,2443.9,2340.9,2422.5,3125.1,3170.3,3217.6,2531.8,2421.5,2507.2,2698.5,2473.5,2496.7,
Printing and related support activities,South Carolina,Millions of current dollars,358.9,362.5,402.9,425.4,416.2,443.4,445.8,292,310.5,347.4,368.2,364.9,248.7,275.2,296.4,355.3,326.2,341.9,380.3,388.4,414,453.0,484.8,467.8,480.4,
Petroleum and coal products manufacturing,South Carolina,Millions of current dollars,39,51.8,36.8,39.7,50.8,50.2,69.7,74.1,50,54.1,57.3,81,69.5,67.3,69.3,72,89.9,140,202.6,178,268.8,266.7,270.5,207.1,456.6,
Chemical manufacturing,South Carolina,Millions of current dollars,2906.9,2805.3,2629.2,2132.3,2095.9,2192.6,2063,2143.7,1655.5,1955.9,3132.5,2625.4,3149.8,3891.8,3776.2,3610.6,3296.9,3720,4345.7,4351.5,4408.4,4787.4,4745.6,4363.9,4814.9,
Plastics and rubber products manufacturing,South Carolina,Millions of current dollars,1793.1,2379.9,2655.7,2921.7,3045.2,2603,3061.4,2563.2,2544.6,2651.1,2487.4,2194.9,2489.2,2256.2,2665,2069.1,2090,2075.1,2753.1,2581.6,3173.8,3598.4,3759.9,3424.8,3567.0,
Wholesale trade,South Carolina,Millions of current dollars,5356.1,5660.4,5796.9,6162.7,6156.6,6321.2,6566.4,7432.3,8335.8,9031.3,9530.4,9782.8,8803.1,9192.7,9589,10191.3,10662.7,11418.8,12023.6,12357.5,12908.3,13766.7,15159.4,15222.2,17548.8,
Retail trade,South Carolina,Millions of current dollars,8114.9,8870.2,9297.1,9525.9,9702.4,9834.7,10503.7,10963.1,11576.3,12033.3,12205.9,11883.7,11506,11633.6,11891.3,12272.1,12934.1,13382.6,13757.2,14202.3,14560.6,15095.7,16262.6,17152.6,19730.9,
Transportation and warehousing,South Carolina,Millions of current dollars,2213.2,2499.6,2635.2,2869.5,2791.6,2858.6,3019.1,3167.2,3516,3740.2,3730.1,3735.6,3420.2,3569.8,3761.4,3932.9,4078.7,4350.1,4775.4,4957.9,5267.1,5667.2,5951.1,5741.3,6608.2,
Air transportation,South Carolina,Millions of current dollars,58,58,66.7,67.5,41.9,68.9,83.4,73.7,102.6,107.2,145.6,145.2,148.8,176.5,180.3,187.5,199,213.6,234.7,262.9,287.1,316.1,296.6,70.3,145.3,
Rail transportation,South Carolina,Millions of current dollars,169.6,194.5,191.9,197.3,183.8,173.4,188.7,205.5,224.9,252,247.8,277.1,254.6,256.6,281.3,304.8,294.4,308.5,326.6,297,295.5,306.6,301.2,274.2,291.9,
Water transportation,South Carolina,Millions of current dollars,7.9,9.6,9,12.5,16.2,7.9,12.8,11.8,13,24.3,27.9,37.8,37.8,55.1,54.2,48.9,59.2,47.9,46.5,53,50.7,59.5,62,60.3,72.6,
Truck transportation,South Carolina,Millions of current dollars,1042.2,1148.9,1217.8,1288.8,1293.8,1287.4,1379.4,1460.4,1568,1689.4,1667.5,1548.1,1341.1,1375.2,1480.6,1548.5,1583,1716,1905.3,1945,2069,2231.0,2345.4,2313,2619.8,
Transit and ground passenger transportation,South Carolina,Millions of current dollars,49.9,62.6,66.6,72.9,68.9,69.6,73,75.9,76.4,84.8,97.6,115.5,126.8,139.1,147.9,154.1,153.8,164.5,175,163.5,145.5,131.9,123.2,106.3,104.7,
Pipeline transportation,South Carolina,Millions of current dollars,16.4,43.6,34.7,20.2,13.5,19.8,15.7,13.2,12.7,13.2,13.2,15.2,14.6,16.4,15.3,21.2,19.4,20,19.5,20.8,19.7,21.5,23.7,21.6,35.8,
Other transportation and support activities,South Carolina,Millions of current dollars,631.2,680.2,723.8,859.5,838.5,866.2,890.5,921,1045.5,1080,1041,1089.2,1008.5,1055,1084.6,1021.3,1034.8,1066.5,1129.9,1159.9,1248.9,1381.8,1498.1,1590.5,1855.1,
Warehousing and storage,South Carolina,Millions of current dollars,238,302.2,324.8,350.8,335.1,365.2,375.6,405.7,472.9,489.3,489.5,507.5,488,495.9,517.1,646.6,735.1,813.1,937.8,1055.8,1150.8,1219.0,1300.9,1305,1482.9,
Information,South Carolina,Millions of current dollars,2511.4,2867.1,2805.2,2737.5,2881.3,3189.2,3334.3,3696.5,3952.7,4183.7,4370.8,4925.4,4877.3,4739.7,4552.3,4417,4814.4,4931.8,5528.1,5830.2,6513.3,7256.6,7598.6,7063.7,8311.8,
Publishing industries (except Internet),South Carolina,Millions of current dollars,355.4,384.9,475.3,406.8,411,514.8,583.7,680.6,782.1,772.6,882.1,884.1,828.1,817.4,871.7,999.7,1097.9,1047.3,1028.3,1078.7,1136.8,1146.1,1159.7,1290.1,2009.8,
Motion picture and sound recording industries,South Carolina,Millions of current dollars,68.5,116.2,116.8,84.3,72.3,136.8,108.6,123.9,77.1,92.8,120.8,140,123.7,129.8,121.6,108,117.9,104.8,176,138.7,242.4,212.0,243.7,124.3,233.6,
Broadcasting (except Internet) and telecommunications,South Carolina,Millions of current dollars,1982.8,2046.7,2009.7,2141.1,2210.7,2239.6,2333.1,2539.9,2750.5,2867.6,3005.7,3407.1,3365.4,3177.1,2878.1,2745,3038,3140.2,3691.5,3897.4,4433.5,5108.5,5270.2,4601.5,4881.8,
"Data processing, hosting, and other information services",South Carolina,Millions of current dollars,104.7,319.4,203.3,105.3,187.3,298,309,352.1,342.9,450.7,362.2,494.1,560,615.4,681,564.3,560.7,639.5,632.4,715.4,700.6,790.0,925,1047.8,1186.6,
"Finance, insurance, real estate, rental, and leasing",South Carolina,Millions of current dollars,13732.5,14759.8,16460.4,17775.4,19413.8,20957.3,21739.7,22962.8,25405.6,26606.3,29520.2,28555,29685.3,29884.3,30962.8,31553.6,32817.1,34885.7,36320.6,38491.7,40271.8,42414.0,44453.3,47730.5,50750.8,
Finance and insurance,South Carolina,Millions of current dollars,3349.1,3793.7,4088.8,4564.1,4866.5,5502.2,5911.4,6244.7,7168.6,7327.2,7654.9,7268.2,7936.9,7663.6,7616.8,7776.9,7747.4,8557.2,9051,9780,10317.3,10911.7,11245.9,12027.1,13009.2,
"Monetary Authorities- central bank, credit intermediation, and related services",South Carolina,Millions of current dollars,1372.9,1651.5,1859.7,2103.8,2353.4,2872.4,2987.4,2829.2,3078.2,3270.4,3342,3381,3487.3,3215.8,3192.6,3369,3282.7,3388.9,3526.4,3738.3,3967.4,4264.4,4486.9,5105.6,5611.4,
"Securities, commodity contracts, and other financial investments and related activities",South Carolina,Millions of current dollars,294.1,307.1,311.9,324.8,389,368.1,333.7,358,440.1,550.1,569.4,294.9,535.9,538.7,490.2,632.9,735,686.2,713.4,864.5,893.6,1091.8,1275.5,1082.2,1296.4,
Insurance carriers and related activities,South Carolina,Millions of current dollars,1673.2,1820.1,1896.9,2116.2,2107.3,2244.1,2403.7,2823.2,3340.1,3257.9,3442.7,3152.3,3377.4,3470.8,3534.2,3586.6,3636.6,4419.5,4783.1,5157,5434.1,5520.5,5437.7,5791.8,6030.2,
"Funds, trusts, and other financial vehicles",South Carolina,Millions of current dollars,9,15.1,20.3,19.3,16.9,17.5,186.6,234.3,310.1,248.9,300.8,440,536.3,438.4,399.8,188.4,93.2,62.5,28.1,20.2,22.2,34.9,45.8,47.5,71.2,
Real estate and rental and leasing,South Carolina,Millions of current dollars,10383.3,10966.1,12371.6,13211.2,14547.3,15455.1,15828.3,16718.1,18237.1,19279.1,21865.3,21286.8,21748.4,22220.6,23346,23776.7,25069.7,26328.5,27269.7,28711.7,29954.6,31502.3,33207.4,35703.4,37741.6,
Real estate,South Carolina,Millions of current dollars,9317.2,9771.2,11006.4,11783.3,13019.1,13924.2,14399.9,15536,16986.6,17802.8,20280.6,19604.5,20127.1,20718,21852.3,22131.7,23239.4,24392.1,25155.4,26369.9,27584.2,29218.1,30764.6,33362.8,35016.8,
Rental and leasing services and lessors of nonfinancial intangible assets,South Carolina,Millions of current dollars,1066.2,1194.9,1365.2,1427.9,1528.2,1530.9,1428.4,1182.1,1250.5,1476.3,1584.7,1682.4,1621.3,1502.6,1493.7,1645,1830.3,1936.4,2114.3,2341.7,2370.3,2284.3,2442.8,2340.5,2724.8,
Professional and business services,South Carolina,Millions of current dollars,8177.4,8082.7,8839.6,9214.5,9793.1,10246.9,10940.7,11970.2,12841,13565.6,14876.5,15766.8,15044.5,16500,17754.9,18327.4,18770,19959.1,20972.4,22090.4,24057.3,25570.8,26572,26184.2,29017.8,
"Professional, scientific, and technical services",South Carolina,Millions of current dollars,4072.9,3875.4,4175.4,4283.4,4720.3,5023.1,5223.4,5687.5,6123.1,6558.4,7223.6,7919.5,7588,8027.4,8779.3,9170.5,9445.4,10000.1,10763.3,11601.5,12522.6,13332.5,13574.8,13593.4,14790.7,
Legal services,South Carolina,Millions of current dollars,867.2,1060.1,1097.2,1100.1,1246,1298.6,1388.3,1492,1651.5,1766.5,1851,1949.3,1722.5,1660.7,1732.7,1739,1749.4,1819.2,1940.6,2109.1,2241,2411.9,2599,2694.1,2896.1,
Computer systems design and related services,South Carolina,Millions of current dollars,288.4,373,449.2,500.4,553.5,539,569.3,556.8,621.6,648.6,784.8,827.7,909.2,967.2,1181.5,1267.1,1360,1443.4,1600,1829,1997.6,2182.6,2399.6,2467,2475.4,
"Miscellaneous professional, scientific, and technical services",South Carolina,Millions of current dollars,2917.3,2442.2,2628.9,2682.9,2920.7,3185.6,3265.8,3638.6,3850,4143.3,4587.8,5142.5,4956.4,5399.5,5865.1,6164.4,6336,6737.5,7222.7,7663.3,8283.9,8738.1,8576.1,8432.3,9419.2,
Management of companies and enterprises,South Carolina,Millions of current dollars,569.7,597.3,628.3,694.4,729.9,721.8,917.5,1265.9,1230.9,1358.8,1426.2,1461.1,1396.3,1419.3,1509.7,1629.5,1702.4,1731.8,1742.9,1935.5,2317.6,2536.6,3053,3040.3,3254.6,
Administrative and support and waste management and remediation services,South Carolina,Millions of current dollars,3534.9,3610,4035.9,4236.7,4343,4502,4799.7,5016.9,5487.1,5648.5,6226.7,6386.2,6060.1,7053.3,7465.9,7527.4,7622.2,8227.2,8466.2,8553.4,9217.2,9701.7,9944.3,9550.5,10972.4,
Administrative and support services,South Carolina,Millions of current dollars,2210.6,2261.6,2476.9,2742.5,2766.3,2867.8,3215.4,3576.8,4045.7,4486,4946.1,5105.6,4707.2,5374.1,5960.3,6152.8,6322.7,6842.4,7002,7054.6,7592,8005.7,8317.8,7825.5,9133.3,
Waste management and remediation services,South Carolina,Millions of current dollars,1324.2,1348.4,1558.9,1494.2,1576.7,1634.2,1584.3,1440,1441.3,1162.5,1280.6,1280.7,1353,1679.2,1505.6,1374.6,1299.5,1384.8,1464.2,1498.8,1625.2,1696.0,1626.4,1725,1839.1,
"Educational services, health care, and social assistance",South Carolina,Millions of current dollars,5114.6,5413.1,5827.9,6236.9,6954.2,7396.1,7883.2,8449.2,8928,9559.9,10193.2,11098.4,11659.2,12268.4,12755.8,13143.2,13570.1,14175.8,15009.6,15747.3,16463.2,17187.4,17890.3,17838.8,19209.8,
Educational services,South Carolina,Millions of current dollars,502.5,518.5,593.8,634.6,685.7,707.5,787,863.3,893.5,975.6,1057.7,1187,1321.3,1390.5,1459.3,1510.7,1546.5,1639.4,1690.9,1781.3,1786.6,1847.0,1911.5,1727.5,1833.9,
Health care and social assistance,South Carolina,Millions of current dollars,4612.1,4894.7,5234.1,5602.3,6268.6,6688.6,7096.2,7585.9,8034.6,8584.3,9135.6,9911.4,10337.9,10877.8,11296.5,11632.6,12023.6,12536.4,13318.7,13966,14676.5,15340.5,15978.7,16111.3,17375.9,
Ambulatory health care services,South Carolina,Millions of current dollars,2770.9,2899.8,3088.4,3309.1,3620.2,3819.4,4040.5,4306.5,4558.3,4836.6,5063.2,5523.6,5757.1,5893.9,6173.7,6346.1,6913.1,7240.8,7686.6,8143.7,8732.7,9189.7,9813.6,9779,10671.8,
Hospitals,South Carolina,Millions of current dollars,971.5,1037.7,1088.8,1144.9,1419.3,1551,1633.8,1812.8,1928.3,2080.3,2270.7,2446.7,2557.1,2874.3,2982.8,3098.4,2909.8,3010.7,3201.6,3275.3,3275.1,3309.1,3102.4,3154.5,3449.9,
Nursing and residential care facilities,South Carolina,Millions of current dollars,537.1,595.1,655.6,716.9,822.2,864.6,928,973.5,1012,1088,1167,1264.9,1340.5,1410.8,1452.3,1474.4,1465.7,1490.5,1577.4,1637,1691.4,1799.4,1936.9,2068.5,2036.8,
Social assistance,South Carolina,Millions of current dollars,332.5,362,401.3,431.4,406.9,453.7,493.9,493.1,536,579.4,634.7,676.2,683.2,698.7,687.7,713.7,735,794.4,852.9,909.9,977.3,1042.3,1125.8,1109.2,1217.4,
"Arts, entertainment, recreation, accommodation, and food services",South Carolina,Millions of current dollars,3693.7,3984.4,4493.2,4582,4496,4710.7,5070.4,5490.4,5719.2,6177.4,7029.9,6689.8,6576.5,6937.8,7236.4,7753.1,8651.1,9328.9,10043.8,10522.4,10850,11426.7,11705.9,9592.6,12314.2,
"Arts, entertainment, and recreation",South Carolina,Millions of current dollars,904.1,914.3,1020.2,828.7,657.2,663.8,706.3,775.7,833.7,900,979.2,1050.3,1036.1,1197.7,1270.3,1313.9,1255.9,1323.2,1364.7,1423.9,1486.6,1569.3,1629.8,1199.4,1576.1,
"Performing arts, spectator sports, museums, and related activities",South Carolina,Millions of current dollars,181.9,190.9,194.3,190.3,189.9,205.9,231.3,270.1,286.8,279.5,268.6,293.9,303,348.3,398,453,458,495.4,511.4,563.6,583.3,614.9,628.5,407.5,608.9,
"Amusement, gambling, and recreation industries",South Carolina,Millions of current dollars,722.2,723.4,825.9,638.5,467.3,457.9,475,505.6,546.8,620.5,710.6,756.3,733.2,849.4,872.4,860.8,797.8,827.8,853.3,860.3,903.3,954.4,1001.3,791.9,967.2,
Accommodation and food services,South Carolina,Millions of current dollars,2789.6,3070,3473,3753.3,3838.8,4046.9,4364.1,4714.6,4885.5,5277.4,6050.7,5639.5,5540.4,5740.1,5966,6439.3,7395.2,8005.7,8679.1,9098.5,9363.4,9857.4,10076.1,8393.3,10738.1,
Accommodation,South Carolina,Millions of current dollars,882.6,976.5,1100.5,1216,1173,1209.4,1267.2,1436.2,1442.2,1645.3,2148.4,1694.5,1570.4,1632.2,1744,1830.3,2482.6,2710.7,2887.3,2981.2,3032.2,3403.1,3135.5,2031.6,2855.1,
Food services and drinking places,South Carolina,Millions of current dollars,1907.1,2093.5,2372.5,2537.3,2665.8,2837.5,3096.9,3278.4,3443.3,3632.2,3902.3,3945.1,3970,4107.9,4222,4608.9,4912.6,5294.9,5791.8,6117.3,6331.2,6454.3,6940.6,6361.6,7883.1,
Other services (except government and government enterprises),South Carolina,Millions of current dollars,2583.8,2969.9,3032.2,3236.4,3055.6,3283.7,3326.4,3536.1,3667.4,3840.4,3975.2,4040.2,3969.7,4012.2,4093.3,4273,4445.6,4703.6,4903.9,5003.2,5159.5,5472.2,5707.6,5669.7,6101.6,
Government and government enterprises,South Carolina,Millions of current dollars,14496.9,15384.7,16579.4,17815.3,18236.8,19226.9,20356.4,21496,22896,24188.4,25475.8,27254.7,27782.7,27754.3,28419.8,29288.2,30195,31026.8,32170.1,33339.9,34147.8,35228.7,36659.4,38382.2,39862.7,
Federal civilian,South Carolina,Millions of current dollars,1842.9,1919.5,1996.2,2153.4,2137.9,2290.3,2400.4,2561.9,2664,2829.1,2998.9,3204,3327.9,3522.3,3563.4,3672.4,3678.7,3749.9,3977.5,4115.2,4279.7,4482.0,4689.1,5042,5184.5,
Military,South Carolina,Millions of current dollars,1822.6,1905.2,2103.2,2224.6,2261.4,2513.5,2818,3027.1,3218.1,3326.2,3535.4,3823.7,4051.9,4108.9,4133.4,4231,4188.2,4084.9,4153.5,4015.5,3896,3661.8,3753.5,3947.3,4315.3,
State and local,South Carolina,Millions of current dollars,10831.4,11560,12480,13437.3,13837.5,14423.1,15138,15906.9,17013.9,18033,18941.5,20226.9,20402.8,20123,20723,21384.9,22328,23192,24039.1,25209.2,25972.1,27084.8,28216.9,29392.8,30362.9,
Natural resources and mining,South Carolina,Millions of current dollars,1151,1014.6,1045.2,1203.2,1292.2,955.7,1326.9,1630.2,1432.7,1487.8,1272.5,1373.2,1387.4,1402.5,1339.4,1366.5,1653.9,1337.9,1453.7,1444.3,1652.1,1713.5,1631.2,1502.9,2029.7,
Trade,South Carolina,Millions of current dollars,13471,14530.6,15094,15688.6,15859.1,16155.8,17070,18395.4,19912.1,21064.7,21736.3,21666.5,20309.1,20826.3,21480.4,22463.4,23596.9,24801.4,25780.8,26559.8,27468.9,28862.4,31422,32374.8,37279.7,
Transportation and utilities,South Carolina,Millions of current dollars,5145.1,5328.6,5698,5946.7,5823.7,5805.3,6109.5,6590,7003,7746.2,7569,7647.4,7916.3,8579.2,8925.1,9030.4,9356.1,9935,10375,10767.4,11057,11110.2,11602.7,11183.1,12516.9,
Manufacturing and information,South Carolina,Millions of current dollars,24549.4,26060,26850.8,26927.6,27770.5,29302,30372.2,27900.5,28500.8,29604.4,30861,30570.5,29880.9,31190.9,32789.4,33446.9,34417.3,35968.2,39856.4,41155,40882.7,42556.2,45759,42410,47576.5,
Private goods-producing industries 2/,South Carolina,Millions of current dollars,28498.6,30135.4,31411.8,32087.3,32964.5,33891.9,35735.8,34395.3,35078.6,36715.1,37999.4,36241.9,33993.1,34357.9,35894.3,37368.8,38792.9,40604.6,44712.3,46767.9,47277.8,48722.5,52375.5,49339.9,54437.1,
Private services-providing industries 3/,South Carolina,Millions of current dollars,54429.5,57936.3,62250.5,65418,68276.8,71745.1,75474.3,81090.7,87429,92744.3,99271.2,100389.6,100037.7,103747.9,107760.9,110961.1,116021.2,122721.4,128934.3,135012.3,141841,149300.2,156952.3,157637.4,175502.6,
